{"schema_version":"COS-V2-EVENT-1.0","event_id":"EVT-20260829T224200Z-PIE050-WORK-PROGRESS-W01","event_type":"WORK_PROGRESS","occurred_at":"2026-08-29T22:42:00Z","project_id":"SWITZERLAND_JOB_OS","agent_id":"AGENT-GPT56SOL-CRM-003","session_id":"SES-20260829T223600Z-PIE050-D42F9A","workstream_id":"WS-CRM-ENTITY-RESOLUTION","objective_id":"CRM_UNIVERSE_COMPLETE","correlation_id":"CORR-20260829-PIE050-CAPTURED27-D42F9A","repo":"rotprods/swiss-OS","main_sha_observed":"ff65e9bd79945294accae55536faeb42f3135a16","base_sha":"9bad0a2c65d12d98915485e4ec45236e3f6c87e0","authority_ceiling":"PREAUTH_REVIEW_ONLY_NO_CANONICAL_MUTATION","summary":"Review wave 01 independently compared five captured provider identities to current canonical candidates and corroborated distinctness without terminal mappings.","next_action":"Continue bounded independent canonical comparison for the remaining 22 captured identities.","idempotency_key":"SWITZERLAND_JOB_OS|SES-20260829T223600Z-PIE050-D42F9A|CRM_UNIVERSE_COMPLETE|WORK_PROGRESS|W01","canonical_hotel_mutation_allowed":false,"h_id_allocation_allowed":false,"outbound_allowed":false}
