{"schema_version":"COS-V2-EVENT-1.0","event_id":"EVT-20260829T223601Z-PIE050-CLAIM-ACQUIRED","event_type":"CLAIM_ACQUIRED","occurred_at":"2026-08-29T22:36:01Z","project_id":"SWITZERLAND_JOB_OS","agent_id":"AGENT-GPT56SOL-CRM-003","session_id":"SES-20260829T223600Z-PIE050-D42F9A","workstream_id":"WS-CRM-ENTITY-RESOLUTION","objective_id":"CRM_UNIVERSE_COMPLETE","correlation_id":"CORR-20260829-PIE050-CAPTURED27-D42F9A","repo":"rotprods/swiss-OS","main_sha_observed":"9bad0a2c65d12d98915485e4ec45236e3f6c87e0","base_sha":"9bad0a2c65d12d98915485e4ec45236e3f6c87e0","authority_ceiling":"PREAUTH_REVIEW_ONLY_NO_CANONICAL_MUTATION","summary":"Acquire fenced provider-identity review claim after V2 qualification; no hotel authority, H-ID, SSR or outbound capability is granted.","next_action":"Start bounded independent canonical comparison of captured provider identities.","idempotency_key":"SWITZERLAND_JOB_OS|SES-20260829T223600Z-PIE050-D42F9A|CRM_UNIVERSE_COMPLETE|CLAIM_ACQUIRED","canonical_hotel_mutation_allowed":false,"h_id_allocation_allowed":false,"outbound_allowed":false}
