{"schema_version":"COS-V2-EVENT-1.0","event_id":"EVT-20260829T223000Z-V2QUAL-CLAIM-RELEASED","event_type":"CLAIM_RELEASED","occurred_at":"2026-08-29T22:30:00Z","project_id":"SWITZERLAND_JOB_OS","agent_id":"AGENT-GPT56SOL-QUAL-001","session_id":"SES-20260829T222600Z-V2QUAL-B91E4D","workstream_id":"WS-V2-QUALIFICATION","objective_id":"OBJ-V2-RECOVERY-DEATH-DRILL","correlation_id":"CORR-20260829-V2QUAL-B91E4D","repo":"rotprods/swiss-OS","main_sha_observed":"e6616d200c35106eae9333a019a566a8f02e4a53","base_sha":"e6616d200c35106eae9333a019a566a8f02e4a53","authority_ceiling":"READ_ONLY_COORDINATION_QUALIFICATION","summary":"Release qualification claim after empirical recovery and zero-context death drills passed in Actions run 33278690926.","next_action":"Persist WORK_COMPLETED, promote CP7/CP8 and rerun drill on the closed-state projection.","idempotency_key":"SWITZERLAND_JOB_OS|SES-20260829T222600Z-V2QUAL-B91E4D|OBJ-V2-RECOVERY-DEATH-DRILL|CLAIM_RELEASED","canonical_hotel_mutation_allowed":false,"h_id_allocation_allowed":false,"outbound_allowed":false}
